{
  "schemaVersion": 1,
  "rulesetVersion": "organic-maps-2026.10.4",
  "minimumAppVersionCode": 1,
  "createdAt": "2026-07-30T00:00:00Z",
  "publisher": "PebbleNTN maintainers",
  "rules": [
    {
      "id": "organic-maps-navigation-step",
      "enabled": true,
      "priority": 100,
      "packageNames": [
        "app.organicmaps"
      ],
      "comment": "Same notification as its CoMaps fork (OM NavigationService.java: title = distToTurn, text = nextStreet, arrow = setLargeIcon only), so maneuver is UNKNOWN on purpose. Locale-agnostic: only the leading number+unit title is matched. From the OM source; validate against a real capture (see comaps/any.json). Road line from text only (#57): a card with just a distance leaves it empty instead of repeating the distance.",
      "conditions": [
        {
          "field": "title",
          "operator": "regex",
          "value": "(?i)^\\s*\\d+(?:[.,]\\d+)?\\s*(?:kilomet(?:re|er)s?|km|miles?|mi|feet|foot|ft|yards?|yd|met(?:re|er)s?|m)\\b"
        }
      ],
      "output": {
        "maneuver": {
          "type": "literal",
          "value": "UNKNOWN"
        },
        "distanceMeters": {
          "type": "distance",
          "field": "title"
        },
        "primaryText": {
          "type": "firstNonEmpty",
          "fields": [
            "text"
          ]
        }
      }
    }
  ]
}
